Attribute,Description,Valid Values,DependsOn,Properties,Required,Parent,DependsOn Component,Source,Validation Rules
Adverse Event Grade,"The text term used to describe a specific histone variants, which are proteins that substitute for the core canonical histones.","Grade 1, Grade 2, Grade 3, Grade 4, Grade 5",,,FALSE,Follow Up,,https://cadsr.cancer.gov/onedata/dmdirect/NIH/NCI/CO/CDEDD?filter=CDEDD.ITEM_ID=2944515&version=1.0,
AIDS Risk Factors,The text term used to describe a risk factor of the acquired immunodeficiency syndrome (AIDS) that the patient either had at time time of the study or experienced in the past.,"Candidiasis,Coccidioidomycosis,Cryptococcosis,Cytomegalovirus,Encephalopathy,Herpes Simplex Virus,Histoplasmosis,Isosporiasis,Mycobacterium avium Complex,Mycobacterium tuberculosis,Mycobacterium, NOS,Nocardiosis,Pneumocystis Pneumonia,Pneumonia, NOS,Progressive Multifocal Leukoencephalopathy,Salmonella Septicemia,Toxoplasmosis,Wasting Syndrome",,,FALSE,Follow Up,,,
Body Surface Area,Numeric value used to represent the 2-dimensional extent of the body surface relating height to weight.,,,,FALSE,Follow Up,,https://cadsr.cancer.gov/onedata/dmdirect/NIH/NCI/CO/CDEDD?filter=CDEDD.ITEM_ID=653&version=6.0,
CD4 Count,The text term used to describe the outcome of the procedure to determine the amount of the CD4 expressing cells in a sample.,,,,FALSE,Follow Up,,https://cadsr.cancer.gov/onedata/dmdirect/NIH/NCI/CO/CDEDD?filter=CDEDD.ITEM_ID=4182751&version=1.0,
CDC HIV Risk Factors,"The text term used to describe a risk factor for human immunodeficiency virus, as described by the Center for Disease Control.","Hemophiliac,Heterosexual Contact,Homosexual Contact,Intravenous Drug User,None,Transfusion Recipient,unknown,Not Reported",,,FALSE,Follow Up,,,
Days to Imaging,Number of days between the date used for index and the date the imaging or scan was performed on the patient. If not applicable please enter 'Not Applicable',,,,FALSE,Follow Up,,,regex match \d+$|Not\sApplicable$|unknown$
Evidence of Recurrence Type,The text term used to describe the type of evidence used to determine whether the patient's disease recurred,"Biopsy with Histologic Confirmation, Convincing Image Source, Positive Biomarkers",,,FALSE,Follow Up,,,
HAART Treatment Indicator,The text term used to indicate whether the patient received Highly Active Antiretroviral Therapy (HAART).,"Yes, No, unknown, Not Reported",,,FALSE,Follow Up,,,
HIV Viral Load,"Numeric value that represents the concentration of an analyte or aliquot extracted from the sample or sample portion, measured in milligrams per milliliter.",,,,FALSE,Follow Up,,https://cadsr.cancer.gov/onedata/dmdirect/NIH/NCI/CO/CDEDD?filter=CDEDD.ITEM_ID=2649682&version=1.0,
Hormonal Contraceptive Use,The text term used to indicate whether the patient used hormonal contraceptives.,"Current User, Former User, Never Used, unknown, Not Reported",,,FALSE,Follow Up,,,
Hysterectomy Margins Involved,The text term used to indicate whether the patient's disease was determined to be involved based on the surgical margins of the hysterectomy.,"Bladder,Macroscopic Parametrium,Microscopic Parametrium,None,Vagina,unknown,Not Reported",,,FALSE,Follow Up,,,
Hysterectomy Type,The text term used to describe the type of hysterectomy the patient had.,"Hysterectomy NOS, Not performed, Radical Hysterectomy, Simple Hysterectomy, unknown, Not Reported",,,FALSE,Follow Up,,,
Imaging Result,The text term used to describe the result of the imaging or scan performed on the patient.,"Positive, Indeterminate, Negative, Not Performed, unknown, Not Reported",,,FALSE,Follow Up,,,
Imaging Type,The text term used to describe the type of imaging or scan performed on the patient.,"99mTc Bone Scintigraphy, CT Scan, MRI, PET",,,FALSE,Follow Up,,,
Immunosuppressive Treatment Type,The text term used to describe the type of immunosuppresive treatment the patient received.,"Anti-TNFTherapy,Azathioprine,Cyclophosphamide,Methotrexate,None,Other,unknown,Not Reported",,,FALSE,Follow Up,,,
Nadir CD4 Count,Numeric value that represents the lowest point to which the CD4 count has dropped (nadir).,,,,FALSE,Follow Up,,,
Pregnancy Outcome,The text term used to describe the type of pregnancy the patient had,"Ectopic Pregnancy,Induced Abortion,Live Birth,Miscarriage,Stillbirth,unknown,Not Reported",,,FALSE,Follow Up,,,
Recist Targeted Regions Number,"Numeric value that represents the number of baseline target lesions, as described by the Response Evaluation Criteria in Solid Tumours (RECIST) criteria",,,,FALSE,Follow Up,,,
Recist Targeted Regions Sum,"Numeric value that represents the sum of baseline target lesions, as described by the Response Evaluation Criteria in Solid Tumours (RECIST) criteria.",,,,FALSE,Follow Up,,,
Scan Tracer Used,The text term used to describe the type of tracer used during the imaging or scan of the patient.,"Acetate, Axumin, Choline, PSMA, Sodium Fluoride",,,FALSE,Follow Up,,,
Progression or Recurrence,Yes/No/unknown indicator to identify whether a patient has had a new tumor event after initial treatment.,"Yes - Progression or Recurrence, No, unknown, Not Reported",,,TRUE,Diagnosis,,https://cadsr.cancer.gov/onedata/dmdirect/NIH/NCI/CO/CDEDD?filter=CDEDD.ITEM_ID=3121376&version=1.0,
Yes - Progression or Recurrence,The patient has had a new tumor event after initial treatment,,"Progression or Recurrence Type, Days to Progression, Days to Progression Free, Days to Recurrence, Progression or Recurrence Anatomic Site",,FALSE,Diagnosis,,,
Progression or Recurrence Anatomic Site,The text term used to describe the anatomic site of resection; biopsy; tissue or organ of biospecimen origin; progression or recurrent disease; treatment,"Abdomen NOS,Abdominal esophagus,Accessory sinus NOS,Acoustic nerve,Adrenal gland NOS,Ampulla of Vater,Anal canal,Anterior 2/3 of tongue NOS,Anterior floor of mouth,Anterior mediastinum,Anterior surface of epiglottis,Anterior wall of bladder,Anterior wall of nasopharynx,Anus NOS,Aortic body and other paraganglia,Appendix,Ascending colon,Autonomic nervous system NOS,Axillary tail of breast,Base of tongue NOS,Bladder neck,Bladder NOS,Blood,Body of pancreas,Body of penis,Body of stomach,Bone marrow,Bone of limb NOS,Bone NOS,Bones of skull and face and associated joints,Border of tongue,Brain stem,Brain NOS,Branchial cleft,Breast NOS,Broad ligament,Cardia NOS,Carotid body,Cauda equina,Cecum,Central portion of breast,Cerebellum NOS,Cerebral meninges,Cerebrum,Cervical esophagus,Cervix uteri,Choroid,Ciliary body,Cloacogenic zone,Colon NOS,Commissure of lip,Conjunctiva,Connective subcutaneous and other soft tissues of abdomen,Connective subcutaneous and other soft tissues of head face and neck,Connective subcutaneous and other soft tissues of lower limb and hip,Connective subcutaneous and other soft tissues of pelvis,Connective subcutaneous and other soft tissues of thorax,Connective subcutaneous and other soft tissues of trunk NOS,Connective subcutaneous and other soft tissues of upper limb and shoulder,Connective subcutaneous and other soft tissues NOS,Cornea NOS,Corpus uteri,Cortex of adrenal gland,Cranial nerve NOS,Craniopharyngeal duct,Descended testis,Descending colon,Dome of bladder,Dorsal surface of tongue NOS,Duodenum,Endocervix,Endocrine gland NOS,Endometrium,Epididymis,Esophagus NOS,Ethmoid sinus,Exocervix,External ear,External lip NOS,External lower lip,External upper lip,Extrahepatic bile duct,Eye NOS,Eyelid,Fallopian tube,Female genital tract NOS,Floor of mouth NOS,Frontal lobe,Frontal sinus,Fundus of stomach,Fundus uteri,Gallbladder,Gastric antrum,Gastrointestinal tract NOS,Glans penis,Glottis,Greater curvature of stomach NOS,Gum NOS,Hard palate,Head of pancreas,Head face or neck NOS,Heart,Hematopoietic system NOS,Hepatic flexure of colon,Hypopharyngeal aspect of aryepiglottic fold,Hypopharynx NOS,Ileum,Ill-defined sites within respiratory system,Intestinal tract NOS,Intra-abdominal lymph nodes,Intrahepatic bile duct,Intrathoracic lymph nodes,Islets of Langerhans,Isthmus uteri,Jejunum,Kidney NOS,Labium majus,Labium minus,Lacrimal gland,Laryngeal cartilage,Larynx NOS,Lateral floor of mouth,Lateral wall of bladder,Lateral wall of nasopharynx,Lateral wall of oropharynx,Lesser curvature of stomach NOS,Lingual tonsil,Lip NOS,Liver,Long bones of lower limb and associated joints,Long bones of upper limb scapula and associated joints,Lower gum,Lower limb NOS,Lower lobe lung,Lower third of esophagus,Lower-inner quadrant of breast,Lower-outer quadrant of breast,Lung NOS,Lymph node NOS,Lymph nodes of axilla or arm,Lymph nodes of head face and neck,Lymph nodes of inguinal region or leg,Lymph nodes of multiple regions,Main bronchus,Major salivary gland NOS,Male genital organs NOS,Mandible,Maxillary sinus,Meckel diverticulum,Mediastinum NOS,Medulla of adrenal gland,Meninges NOS,Middle ear,Middle lobe lung,Middle third of esophagus,Mouth NOS,Mucosa of lip NOS,Mucosa of lower lip,Mucosa of upper lip,Myometrium,Nasal cavity,Nasopharynx NOS,Nervous system NOS,Nipple,Occipital lobe,Olfactory nerve,Optic nerve,Orbit NOS,Oropharynx NOS,Other ill-defined sites,Other specified parts of female genital organs,Other specified parts of male genital organs,Other specified parts of pancreas,Ovary,Overlapping lesion of accessory sinuses,Overlapping lesion of bladder,Overlapping lesion of bones joints and articular cartilage,Overlapping lesion of bones joints and articular cartilage of limbs,Overlapping lesion of brain,Overlapping lesion of brain and central nervous system,Overlapping lesion of breast,Overlapping lesion of cervix uteri,Overlapping lesion of colon,Overlapping lesion of connective subcutaneous and other soft tissues,Overlapping lesion of corpus uteri,Overlapping lesion of digestive system,Overlapping lesion of endocrine glands and related structures,Overlapping lesion of esophagus,Overlapping lesion of eye and adnexa,Overlapping lesion of female genital organs,Overlapping lesion of floor of mouth,Overlapping lesion of heart mediastinum and pleura,Overlapping lesion of hypopharynx,Overlapping lesion of ill-defined sites,Overlapping lesion of larynx,Overlapping lesion of lip,Overlapping lesion of lip oral cavity and pharynx,Overlapping lesion of lung,Overlapping lesion of major salivary glands,Overlapping lesion of male genital organs,Overlapping lesion of nasopharynx,Overlapping lesion of other and unspecified parts of mouth,Overlapping lesion of palate,Overlapping lesion of pancreas,Overlapping lesion of penis,Overlapping lesion of peripheral nerves and autonomic nervous system,Overlapping lesion of rectum anus and anal canal,Overlapping lesion of respiratory system and intrathoracic organs,Overlapping lesion of retroperitoneum and peritoneum,Overlapping lesion of skin,Overlapping lesion of small intestine,Overlapping lesion of stomach,Overlapping lesion of tongue,Overlapping lesion of tonsil,Overlapping lesion of urinary organs,Overlapping lesion of vulva,Overlapping lesions of oropharynx,Palate NOS,Pancreas NOS,Pancreatic duct,Parametrium,Parathyroid gland,Paraurethral gland,Parietal lobe,Parotid gland,Pelvic bones sacrum coccyx and associated joints,Pelvic lymph nodes,Pelvis NOS,Penis NOS,Peripheral nerves and autonomic nervous system of abdomen,Peripheral nerves and autonomic nervous system of head face and neck,Peripheral nerves and autonomic nervous system of lower limb and hip,Peripheral nerves and autonomic nervous system of pelvis,Peripheral nerves and autonomic nervous system of thorax,Peripheral nerves and autonomic nervous system of trunk NOS,Peripheral nerves and autonomic nervous system of upper limb and shoulder,Peritoneum NOS,Pharynx NOS,Pineal gland,Pituitary gland,Placenta,Pleura NOS,Postcricoid region,Posterior mediastinum,Posterior wall of bladder,Posterior wall of hypopharynx,Posterior wall of nasopharynx,Posterior wall of oropharynx,Prepuce,Prostate gland,Pylorus,Pyriform sinus,Rectosigmoid junction,Rectum NOS,Renal pelvis,Reticuloendothelial system NOS,Retina,Retromolar area,Retroperitoneum,Rib sternum clavicle and associated joints,Round ligament,Scrotum NOS,Short bones of lower limb and associated joints,Short bones of upper limb and associated joints,Sigmoid colon,Skin of lip NOS,Skin of lower limb and hip,Skin of other and unspecified parts of face,Skin of scalp and neck,Skin of trunk,Skin of upper limb and shoulder,Skin NOS,Small intestine NOS,Soft palate NOS,Specified parts of peritoneum,Spermatic cord,Sphenoid sinus,Spinal cord,Spinal meninges,Spleen,Splenic flexure of colon,Stomach NOS,Subglottis,Sublingual gland,Submandibular gland,Superior wall of nasopharynx,Supraglottis,Tail of pancreas,Temporal lobe,Testis NOS,Thoracic esophagus,Thorax NOS,Thymus,Thyroid gland,Tongue NOS,Tonsil NOS,Tonsillar fossa,Tonsillar pillar,Trachea,Transverse colon,Trigone of bladder,Undescended testis,unknown primary site,Upper gum,Upper limb NOS,Upper lobe lung,Upper respiratory tract NOS,Upper third of esophagus,Upper-inner quadrant of breast,Upper-outer quadrant of breast,Urachus,Ureter,Ureteric orifice,Urethra,Urinary system NOS,Uterine adnexa,Uterus NOS,Uvula,Vagina NOS,Vallecula,Ventral surface of tongue NOS,Ventricle NOS,Vertebral column,Vestibule of mouth,Vulva NOS,Waldeyer ring,Biliary tract NOS,Cheek mucosa,Clitoris,Overlapping lesion of biliary tract,unknown,Not Reported",,,FALSE,Follow Up,,https://cadsr.cancer.gov/onedata/dmdirect/NIH/NCI/CO/CDEDD?filter=CDEDD.ITEM_ID=6161026&version=1.0,
Treatment Anatomic Site,The text term used to describe the anatomic site of resection; biopsy; tissue or organ of biospecimen origin; progression or recurrent disease; treatment,"Abdomen NOS,Abdominal esophagus,Accessory sinus NOS,Acoustic nerve,Adrenal gland NOS,Ampulla of Vater,Anal canal,Anterior 2/3 of tongue NOS,Anterior floor of mouth,Anterior mediastinum,Anterior surface of epiglottis,Anterior wall of bladder,Anterior wall of nasopharynx,Anus NOS,Aortic body and other paraganglia,Appendix,Ascending colon,Autonomic nervous system NOS,Axillary tail of breast,Base of tongue NOS,Bladder neck,Bladder NOS,Blood,Body of pancreas,Body of penis,Body of stomach,Bone marrow,Bone of limb NOS,Bone NOS,Bones of skull and face and associated joints,Border of tongue,Brain stem,Brain NOS,Branchial cleft,Breast NOS,Broad ligament,Cardia NOS,Carotid body,Cauda equina,Cecum,Central portion of breast,Cerebellum NOS,Cerebral meninges,Cerebrum,Cervical esophagus,Cervix uteri,Choroid,Ciliary body,Cloacogenic zone,Colon NOS,Commissure of lip,Conjunctiva,Connective subcutaneous and other soft tissues of abdomen,Connective subcutaneous and other soft tissues of head face and neck,Connective subcutaneous and other soft tissues of lower limb and hip,Connective subcutaneous and other soft tissues of pelvis,Connective subcutaneous and other soft tissues of thorax,Connective subcutaneous and other soft tissues of trunk NOS,Connective subcutaneous and other soft tissues of upper limb and shoulder,Connective subcutaneous and other soft tissues NOS,Cornea NOS,Corpus uteri,Cortex of adrenal gland,Cranial nerve NOS,Craniopharyngeal duct,Descended testis,Descending colon,Dome of bladder,Dorsal surface of tongue NOS,Duodenum,Endocervix,Endocrine gland NOS,Endometrium,Epididymis,Esophagus NOS,Ethmoid sinus,Exocervix,External ear,External lip NOS,External lower lip,External upper lip,Extrahepatic bile duct,Eye NOS,Eyelid,Fallopian tube,Female genital tract NOS,Floor of mouth NOS,Frontal lobe,Frontal sinus,Fundus of stomach,Fundus uteri,Gallbladder,Gastric antrum,Gastrointestinal tract NOS,Glans penis,Glottis,Greater curvature of stomach NOS,Gum NOS,Hard palate,Head of pancreas,Head face or neck NOS,Heart,Hematopoietic system NOS,Hepatic flexure of colon,Hypopharyngeal aspect of aryepiglottic fold,Hypopharynx NOS,Ileum,Ill-defined sites within respiratory system,Intestinal tract NOS,Intra-abdominal lymph nodes,Intrahepatic bile duct,Intrathoracic lymph nodes,Islets of Langerhans,Isthmus uteri,Jejunum,Kidney NOS,Labium majus,Labium minus,Lacrimal gland,Laryngeal cartilage,Larynx NOS,Lateral floor of mouth,Lateral wall of bladder,Lateral wall of nasopharynx,Lateral wall of oropharynx,Lesser curvature of stomach NOS,Lingual tonsil,Lip NOS,Liver,Long bones of lower limb and associated joints,Long bones of upper limb scapula and associated joints,Lower gum,Lower limb NOS,Lower lobe lung,Lower third of esophagus,Lower-inner quadrant of breast,Lower-outer quadrant of breast,Lung NOS,Lymph node NOS,Lymph nodes of axilla or arm,Lymph nodes of head face and neck,Lymph nodes of inguinal region or leg,Lymph nodes of multiple regions,Main bronchus,Major salivary gland NOS,Male genital organs NOS,Mandible,Maxillary sinus,Meckel diverticulum,Mediastinum NOS,Medulla of adrenal gland,Meninges NOS,Middle ear,Middle lobe lung,Middle third of esophagus,Mouth NOS,Mucosa of lip NOS,Mucosa of lower lip,Mucosa of upper lip,Myometrium,Nasal cavity,Nasopharynx NOS,Nervous system NOS,Nipple,Occipital lobe,Olfactory nerve,Optic nerve,Orbit NOS,Oropharynx NOS,Other ill-defined sites,Other specified parts of female genital organs,Other specified parts of male genital organs,Other specified parts of pancreas,Ovary,Overlapping lesion of accessory sinuses,Overlapping lesion of bladder,Overlapping lesion of bones joints and articular cartilage,Overlapping lesion of bones joints and articular cartilage of limbs,Overlapping lesion of brain,Overlapping lesion of brain and central nervous system,Overlapping lesion of breast,Overlapping lesion of cervix uteri,Overlapping lesion of colon,Overlapping lesion of connective subcutaneous and other soft tissues,Overlapping lesion of corpus uteri,Overlapping lesion of digestive system,Overlapping lesion of endocrine glands and related structures,Overlapping lesion of esophagus,Overlapping lesion of eye and adnexa,Overlapping lesion of female genital organs,Overlapping lesion of floor of mouth,Overlapping lesion of heart mediastinum and pleura,Overlapping lesion of hypopharynx,Overlapping lesion of ill-defined sites,Overlapping lesion of larynx,Overlapping lesion of lip,Overlapping lesion of lip oral cavity and pharynx,Overlapping lesion of lung,Overlapping lesion of major salivary glands,Overlapping lesion of male genital organs,Overlapping lesion of nasopharynx,Overlapping lesion of other and unspecified parts of mouth,Overlapping lesion of palate,Overlapping lesion of pancreas,Overlapping lesion of penis,Overlapping lesion of peripheral nerves and autonomic nervous system,Overlapping lesion of rectum anus and anal canal,Overlapping lesion of respiratory system and intrathoracic organs,Overlapping lesion of retroperitoneum and peritoneum,Overlapping lesion of skin,Overlapping lesion of small intestine,Overlapping lesion of stomach,Overlapping lesion of tongue,Overlapping lesion of tonsil,Overlapping lesion of urinary organs,Overlapping lesion of vulva,Overlapping lesions of oropharynx,Palate NOS,Pancreas NOS,Pancreatic duct,Parametrium,Parathyroid gland,Paraurethral gland,Parietal lobe,Parotid gland,Pelvic bones sacrum coccyx and associated joints,Pelvic lymph nodes,Pelvis NOS,Penis NOS,Peripheral nerves and autonomic nervous system of abdomen,Peripheral nerves and autonomic nervous system of head face and neck,Peripheral nerves and autonomic nervous system of lower limb and hip,Peripheral nerves and autonomic nervous system of pelvis,Peripheral nerves and autonomic nervous system of thorax,Peripheral nerves and autonomic nervous system of trunk NOS,Peripheral nerves and autonomic nervous system of upper limb and shoulder,Peritoneum NOS,Pharynx NOS,Pineal gland,Pituitary gland,Placenta,Pleura NOS,Postcricoid region,Posterior mediastinum,Posterior wall of bladder,Posterior wall of hypopharynx,Posterior wall of nasopharynx,Posterior wall of oropharynx,Prepuce,Prostate gland,Pylorus,Pyriform sinus,Rectosigmoid junction,Rectum NOS,Renal pelvis,Reticuloendothelial system NOS,Retina,Retromolar area,Retroperitoneum,Rib sternum clavicle and associated joints,Round ligament,Scrotum NOS,Short bones of lower limb and associated joints,Short bones of upper limb and associated joints,Sigmoid colon,Skin of lip NOS,Skin of lower limb and hip,Skin of other and unspecified parts of face,Skin of scalp and neck,Skin of trunk,Skin of upper limb and shoulder,Skin NOS,Small intestine NOS,Soft palate NOS,Specified parts of peritoneum,Spermatic cord,Sphenoid sinus,Spinal cord,Spinal meninges,Spleen,Splenic flexure of colon,Stomach NOS,Subglottis,Sublingual gland,Submandibular gland,Superior wall of nasopharynx,Supraglottis,Tail of pancreas,Temporal lobe,Testis NOS,Thoracic esophagus,Thorax NOS,Thymus,Thyroid gland,Tongue NOS,Tonsil NOS,Tonsillar fossa,Tonsillar pillar,Trachea,Transverse colon,Trigone of bladder,Undescended testis,unknown primary site,Upper gum,Upper limb NOS,Upper lobe lung,Upper respiratory tract NOS,Upper third of esophagus,Upper-inner quadrant of breast,Upper-outer quadrant of breast,Urachus,Ureter,Ureteric orifice,Urethra,Urinary system NOS,Uterine adnexa,Uterus NOS,Uvula,Vagina NOS,Vallecula,Ventral surface of tongue NOS,Ventricle NOS,Vertebral column,Vestibule of mouth,Vulva NOS,Waldeyer ring,Biliary tract NOS,Cheek mucosa,Clitoris,Overlapping lesion of biliary tract,unknown,Not Reported",,,FALSE,Follow Up,,https://cadsr.cancer.gov/onedata/dmdirect/NIH/NCI/CO/CDEDD?filter=CDEDD.ITEM_ID=6161026&version=1.0,
NCI Atlas Cancer Site,"The primary tumor site used to calculate the incidence rate using the NCI Cancer Atlas, a digital atlas which provides geographical data related to cancer utilizing the Surveillance, Epidemiology, and End Results (SEER) Program cancer incidence rates for 2013 to 2017","Bladder, Brain And Other Nervous System, Female Breast, In situ Female Breast, Cervix Uteri, Less Than Age, Malignant Childhood Neoplasm, Colon And Rectum, Esophagus, Kidney And Renal Pelvis, Leukemia, Liver And Bile Duct, Lung And Bronchus, Cutaneous Melanoma, Non-Hodgkin's Lymphoma, Oral Cavity And Pharynx, Ovary, Pancreas, Prostate Gland, Stomach, Thyroid Gland, Uterus",,,FALSE,Diagnosis,,https://cadsr.cancer.gov/onedata/dmdirect/NIH/NCI/CO/CDEDD?filter=CDEDD.ITEM_ID=7639473&version=1.0,
Progression or Recurrence Type,The text term used to describe the type of progressive or recurrent disease or relapsed disease.,"Biochemical, Distant, Local, Regional, unknown, Not Reported",,,FALSE,Diagnosis,,https://cadsr.cancer.gov/onedata/dmdirect/NIH/NCI/CO/CDEDD?filter=CDEDD.ITEM_ID=6142385&version=1.0,
Reflux Treatment Type,Text term used to describe the types of treatment used to manage gastroesophageal reflux disease (GERD).,"Antacids, H2 Blockers, Medically Treated, No Treatment, Not Applicable, Not Reported, Proton Pump Inhibitors, Surgically Treated, unknown",,,FALSE,Follow Up,,https://cadsr.cancer.gov/onedata/dmdirect/NIH/NCI/CO/CDEDD?filter=CDEDD.ITEM_ID=3440206&version=1.0,
Risk Factor,The text term used to describe a risk factor the patient had at the time of or prior to their diagnosis.,"Alcohol Consumption,Alcoholic Liver Disease,Allergy Animal NOS,Allergy Ant,Allergy Bee,Allergy Cat,Allergy Dairy or Lactose,Allergy Dog,Allergy Eggs,Allergy Food NOS,Allergy Fruit,Allergy Meat,Allergy Mold or Dust,Allergy Nuts,Allergy Processed Foods,Allergy Seafood,Allergy Wasp,Alpha-1 Antitrypsin Deficiency,Autoimmune Atrophic Chronic Gastritis,Barrett's Esophagus,Beckwith-Wiedemann,Behcet's Disease,Cancer,Cholelithiasis,Chronic Hepatitis,Cirrhosis,Colon Polyps,Common variable immune deficiency (CVID),Denys-Drash Syndrome,Diabetes NOS,Diabetes Type I,Diabetes Type II,Diet,Diverticulitis,Endometriosis,Endosalpingiosis,Eczema,Epstein-Barr Virus,Familial Adenomatous Polyposis,Fanconi Anemia,Fibrosis,Gastric Polyp(s),Gilbert's Syndrome,Gorlin Syndrome,Hashimoto's Thyroiditis,Hay Fever,Headache,Helicobacter Pylori-Associated Gastritis,Hematologic Disorder NOS,Hemihypertrophy,Hemochromatosis,Hepatic Encephalopathy,Hepatitis B Infection,Hepatitis C Infection,Hepatitis NOS,High Grade Dysplasia,HIV,Human Papillomavirus Infection,Hypospadias,Intestinal Metaplasia,Iron Overload,Li-Fraumeni Syndrome,Low Grade Dysplasia,Lymphocytic Thyroiditis,Lynch Syndrome,Myasthenia Gravis,Nonalcoholic Fatty Liver Disease,Nonalcoholic Steatohepatitis,Obesity,Oral Contraceptives,Pancreatitis,Parasitic Disease of Biliary Tract,Primary Sclerosing Cholangitis,Recurrent Pyogenic Cholangitis,Reflux Disease,Rheumatoid Arthritis,Rubinstein-Taybi Syndrome,Sarcoidosis,Seizure,Sensory Changes,Serous tubal intraepithelial carcinoma (STIC),Steatosis,Tattoo,Thyroid Nodular Hyperplasia,Tobacco NOS,Tobacco Smokeless,Tobacco Smoking,Turcot Syndrome,Undescended Testis,Vision Changes,Wagr Syndrome,unknown,Not Reported",,,FALSE,Follow Up,,https://cadsr.cancer.gov/onedata/dmdirect/NIH/NCI/CO/CDEDD?filter=CDEDD.ITEM_ID=6142389&version=1.0,
Risk Factor Treatment,The yes/no/unknown indicator used to describe whether the patient received treatment for a risk factor the patient had at the time of or prior to their diagnosis.,"Yes, No, unknown, Not Reported",,,FALSE,Follow Up,,https://cadsr.cancer.gov/onedata/dmdirect/NIH/NCI/CO/CDEDD?filter=CDEDD.ITEM_ID=6514356&version=1.0,
Viral Hepatitis Serologies,Text term that describes the kind of serological laboratory test used to determine the patient's hepatitus status.,"HBV Core Antibody, HBV DNA, HBV Genotype, HBV Surface Antibody, HCV Genotype, Hepatitis B Surface Antigen, Hepatitis C Antibody, Hepatitis C Virus RNA, unknown, Not Reported",,,FALSE,Follow Up,,https://cadsr.cancer.gov/onedata/dmdirect/NIH/NCI/CO/CDEDD?filter=CDEDD.ITEM_ID=4395982&version=1.0,
Weight,The weight of the patient measured in kilograms.,,,,FALSE,Follow Up,,https://cadsr.cancer.gov/onedata/dmdirect/NIH/NCI/CO/CDEDD?filter=CDEDD.ITEM_ID=651&version=4.0,
