,Attribute,Label,Description,Required,Cond_Req,Valid Values,Conditional Requirements,Component
Days to Last Follow up,Days to Last Follow up,DaystoLastFollowup,"Time interval from the date of last follow up to the date of initial pathologic diagnosis, represented as a calculated number of days. If not applicable please enter 'Not Applicable'",True,,,,Diagnosis
Prior Treatment,Prior Treatment,PriorTreatment,A yes/no/unknown/not applicable indicator related to the administration of therapeutic agents received before the body specimen was collected.,False,,"['Not Allowed To Collect', 'no', 'unknown', 'Not Reported', 'yes', '']",,Diagnosis
Age at Diagnosis,Age at Diagnosis,AgeatDiagnosis,Age at the time of diagnosis expressed in number of days since birth.,True,,,,Diagnosis
Peritoneal Fluid Cytological Status,Peritoneal Fluid Cytological Status,PeritonealFluidCytologicalStatus,The text term used to describe the malignant status of the peritoneal fluid determined by cytologic testing.,False,,"['Atypical', 'Malignant', 'Unsatisfactory', 'Non-Malignant', 'unknown', 'Not Reported', '']",,Diagnosis
Margin Distance,Margin Distance,MarginDistance,Numeric value (in centimeters) that represents the distance between the tumor and the surgical margin.,False,,,,Diagnosis
Micropapillary Features,Micropapillary Features,MicropapillaryFeatures,The yes/no/unknown indicator used to describe whether micropapillary features were determined to be present.,False,,"['Not Reported', 'Absent', 'Present', 'unknown', '']",,Diagnosis
INPC Histologic Group,INPC Histologic Group,INPCHistologicGroup,"The text term used to describe the classification of neuroblastomas distinguishing between favorable and unfavorable histologic groups. The histologic score, defined by the International Neuroblastoma Pathology Classification (INPC), is based on age, mitosis-karyorrhexis index (MKI), stromal content and degree of tumor cell differentiation.",False,,"['Not Reported', 'Favorable', 'Unfavorable', 'unknown', '']",,Diagnosis
Component,Component,Component,"Category of metadata (e.g. Diagnosis, Biospecimen, scRNA-seq Level 1, etc.); provide the same one for all items/rows.",True,,,,Diagnosis
INSS Stage,INSS Stage,INSSStage,"Text term used to describe the staging classification of neuroblastic tumors, as defined by the International Neuroblastoma Staging System (INSS).",False,,"['Stage 2B', 'Stage 3', 'Stage 2A', 'unknown', 'Stage 1', 'Not Reported', 'Stage 4S', 'Stage 4', '']",,Diagnosis
Cog Neuroblastoma Risk Group,Cog Neuroblastoma Risk Group,CogNeuroblastomaRiskGroup,Text term that represents the categorization of patients on the basis of prognostic factors per a system developed by Children's Oncology Group (COG). Risk level is used to assign treatment intensity.,False,,"['High Risk', 'Intermediate Risk', 'unknown', 'Low Risk', 'Not Reported', '']",,Diagnosis
AJCC Clinical N,AJCC Clinical N,AJCCClinicalN,Extent of the regional lymph node involvement for the cancer based on evidence obtained from clinical assessment parameters determined prior to treatment.,False,,"['N2c', 'N3b', 'N0', 'N3', 'N2a', 'N1a', 'N1c', 'N3c', 'unknown', 'N2b', 'N0 (i+)', 'NX', 'N2', 'N1bIV', 'N1', 'N1bII', 'N0 (i-)', 'N3a', 'N1bI', 'N0 (mol-)', 'N1b', 'N0 (mol+)', 'N4', 'Not Reported', 'N1mi', 'N1bIII', '']",,Diagnosis
Ovarian Specimen Status,Ovarian Specimen Status,OvarianSpecimenStatus,The text term used to describe the physical condition of the involved ovary.,False,,"['Ovarian Capsule Intact', 'unknown', 'Ovarian Capsule Fragmented', 'Not Reported', 'Ovarian Capsule Ruptured', '']",,Diagnosis
Classification of Tumor,Classification of Tumor,ClassificationofTumor,Text that describes the kind of disease present in the tumor specimen as related to a specific timepoint.,False,,"['Other', 'Metastasis', 'Primary', 'Not Allowed To Collect', 'unknown', 'Not Reported', 'Recurrence', '']",,Diagnosis
Mitosis Karyorrhexis Index,Mitosis Karyorrhexis Index,MitosisKaryorrhexisIndex,Text term that represents the component of the International Neuroblastoma Pathology Classification (INPC) for mitosis-karyorrhexis index (MKI).,False,,"['Low', 'unknown', 'Intermediate', 'Not Reported', 'High', '']",,Diagnosis
Days to Last Known Disease Status,Days to Last Known Disease Status,DaystoLastKnownDiseaseStatus,"Time interval from the date of last follow up to the date of initial pathologic diagnosis, represented as a calculated number of days. If not applicable please enter 'Not Applicable'",True,,,,Diagnosis
Last Known Disease Status,Last Known Disease Status,LastKnownDiseaseStatus,Text term that describes the last known state or condition of an individual's neoplasm.,True,,"['unknown tumor status', 'Not Allowed To Collect', 'Not Applicable', 'Distant met recurrence/progression', 'With tumor', 'Loco-regional recurrence/progression', 'Not Reported', 'Tumor free', 'Biochemical evidence of disease without structural correlate']",,Diagnosis
Margins Involved Site,Margins Involved Site,MarginsInvolvedSite,The text term used to describe the anatomic sites that were involved in the survival margins.,False,,"['Parenchyma', 'Renal Capsule', 'Renal Sinus', 'Gerota Fascia', 'Ureter', 'Renal', 'Renal Vein', 'Perinephric Fat', '']",,Diagnosis
Secondary Gleason Grade,Secondary Gleason Grade,SecondaryGleasonGrade,"The text term used to describe the secondary Gleason score, which describes the pattern of cells making up the second largest area of the tumor. The primary and secondary Gleason pattern grades are combined to determine the patient's Gleason grade group, which is used to determine the aggresiveness of prostate cancer. Note that this grade describes the entire prostatectomy specimen and is not specific to the sample used for sequencing.",False,,"['Pattern 4', 'Pattern 5', 'Pattern 2', 'Pattern 1', 'Pattern 3', '']",,Diagnosis
IRS Stage,IRS Stage,IRSStage,"The text term used to describe the classification of rhabdomyosarcoma tumors, as defined by the Intergroup Rhabdomyosarcoma Study (IRS).",False,,"['2', '4', '3', 'unknown', 'Not Reported', '1', '']",,Diagnosis
Non Nodal Tumor Deposits,Non Nodal Tumor Deposits,NonNodalTumorDeposits,The yes/no/unknown indicator used to describe the presence of tumor deposits in the pericolic or perirectal fat or in adjacent mesentery away from the leading edge of the tumor.,False,,"['Not Reported', 'no', 'yes', 'unknown', '']",,Diagnosis
WHO CNS Grade,WHO CNS Grade,WHOCNSGrade,WHO CNS Grade,False,,"['Grade III', 'Grade IV', 'Grade Not Assigned', 'unknown', 'Grade I', 'Grade II', 'Not Reported', '']",,Diagnosis
WHO NTE Grade,WHO NTE Grade,WHONTEGrade,WHO NTE Grade,False,,"['G2', 'G3', 'GX', 'unknown', 'G1', 'Not Reported', '']",,Diagnosis
Percent Tumor Invasion,Percent Tumor Invasion,PercentTumorInvasion,The percentage of tumor cells spread locally in a malignant neoplasm through infiltration or destruction of adjacent tissue.,False,,,,Diagnosis
Anaplasia Present,Anaplasia Present,AnaplasiaPresent,Yes/no/unknown/Not Reported indicator used to describe whether anaplasia was present at the time of diagnosis.,False,,"['Not Reported', 'no', 'Yes - Anaplasia Present', 'unknown', '']",,Diagnosis
Precancerous Condition Type,Precancerous Condition Type,PrecancerousConditionType,The classification of pre-cancerous cells found in a specific collection of data being studied by the Consortium for Molecular and Cellular Characterization of Screen-Detected Lesions (MCL).,False,,"['Severe dysplasia', 'Scar - no residual melanoma', 'Acral-lentiginous', 'Hamartoma', 'Ductal Carcinoma In Situ', 'Melanoma in situ', 'Invasive melanoma - desmoplastic', 'Normal', 'Other', 'Reserve cell hyperplasia', 'Prostatic Intraepithelial Neoplasia', 'Squamous carcinoma in situ', 'Melanocytic hyperplasia', 'Carcinoma NOS', 'Melanoma in situ arising in a giant congenital nevus', 'Moderate dysplasia', 'Benign tumor NOS', 'Adenocarcinoma in situ - non mucinous', 'Lentigo maligna type', 'No diagnosis possible', 'Invasive melanoma', 'Mild dysplasia', 'Adenocarcinoma in situ - mucinous', 'Invasive melanoma - superficial spreading', 'Squamous metaplasia - mature', 'Squamous metaplasia - immature', 'Atypical Adenomatous Lung Hyperplasia', 'Superficial spreading', 'Pancreatic Intraductal Papillary-Mucinous Neoplasm', 'Persistent melanoma in situ', 'Not Applicable', 'Invasive melanoma - lentigo maligna', 'Invasive melanoma - acral lentiginous', 'Normal WDA', 'Atypical melanocytic proliferation', 'Atypical adenomatous hyperplasia', 'Pancreatic Intraepithelial Neoplasia', 'Invasive melanoma - nevoid', 'Neuroendocrine cell hyperplasia', 'Invasive melanoma - nodular type', 'Melanoma in situ not otherwise classified', '']",,Diagnosis
Gleason Patterns Percent,Gleason Patterns Percent,GleasonPatternsPercent,"Numeric value that represents the percentage of Patterns 4 and 5, which is used when the Gleason score is greater than 7 to predict prognosis.",False,,,,Diagnosis
AJCC Staging System Edition,AJCC Staging System Edition,AJCCStagingSystemEdition,"The text term used to describe the version or edition of the American Joint Committee on Cancer Staging Handbooks, a publication by the group formed for the purpose of developing a system of staging for cancer that is acceptable to the American medical profession and is compatible with other accepted classifications.",False,,"['1st', '7th', '3rd', '5th', '8th', 'unknown', '4th', 'Not Reported', '6th', '2nd', '']",,Diagnosis
Progression or Recurrence Anatomic Site,Progression or Recurrence Anatomic Site,ProgressionorRecurrenceAnatomicSite,The text term used to describe the anatomic site of resection; biopsy; tissue or organ of biospecimen origin; progression or recurrent disease; treatment,False,True,"['Olfactory nerve', 'Overlapping lesion of bladder', 'Anterior floor of mouth', 'Bone marrow', 'Other specified parts of female genital organs', 'Parametrium', 'Overlapping lesion of lung', 'Connective subcutaneous and other soft tissues of lower limb and hip', 'Branchial cleft', 'Lower gum', 'Renal pelvis', 'skin NOS', 'Overlapping lesion of accessory sinuses', 'Gastric antrum', 'Overlapping lesion of cervix uteri', 'Nasal cavity', 'Peripheral nerves and autonomic nervous system of thorax', 'Autonomic nervous system NOS', 'Overlapping lesion of nasopharynx', 'Lateral wall of oropharynx', 'Upper-inner quadrant of breast', 'Thymus', 'Posterior mediastinum', 'Anus NOS', 'Overlapping lesion of connective subcutaneous and other soft tissues', 'Stomach NOS', 'Broad ligament', 'Cloacogenic zone', 'Connective subcutaneous and other soft tissues of upper limb and shoulder', 'Lateral wall of bladder', 'Peripheral nerves and autonomic nervous system of lower limb and hip', 'Biliary tract NOS', 'Anterior 2/3 of tongue NOS', 'Testis NOS', 'Overlapping lesion of ill-defined sites', 'Uterine adnexa', 'Fundus uteri', 'Central portion of breast', 'Overlapping lesion of skin', 'Lateral wall of nasopharynx', 'Nipple', 'Overlapping lesion of urinary organs', 'Soft palate NOS', 'Main bronchus', 'Trachea', 'Upper lobe lung', 'Anterior wall of nasopharynx', 'Specified parts of peritoneum', 'Body of penis', 'Tonsillar fossa', 'Overlapping lesion of breast', 'Adrenal gland NOS', 'Hepatic flexure of colon', 'Aortic body and other paraganglia', 'Frontal lobe', 'Pleura NOS', 'Lateral floor of mouth', 'Intrathoracic lymph nodes', 'Overlapping lesion of respiratory system and intrathoracic organs', 'Peripheral nerves and autonomic nervous system of upper limb and shoulder', 'Pylorus', 'Skin of lip NOS', 'Lesser curvature of stomach NOS', 'Overlapping lesion of peripheral nerves and autonomic nervous system', 'Peripheral nerves and autonomic nervous system of abdomen', 'Waldeyer ring', 'Axillary tail of breast', 'Cervical esophagus', 'Not Reported', 'Round ligament', 'Anterior mediastinum', 'Cecum', 'Cerebrum', 'Cerebellum NOS', 'Ureteric orifice', 'Abdomen NOS', 'Brain NOS', 'Major salivary gland NOS', 'Thyroid gland', 'Overlapping lesion of rectum anus and anal canal', 'Upper-outer quadrant of breast', 'Peritoneum NOS', 'Male genital organs NOS', 'Cranial nerve NOS', 'Gum NOS', 'Ethmoid sinus', 'Subglottis', 'Meninges NOS', 'Nasopharynx NOS', 'Spinal cord', 'Clitoris', 'Labium majus', 'Urachus', 'Duodenum', 'Short bones of upper limb and associated joints', 'Posterior wall of oropharynx', 'Vulva NOS', 'Thorax NOS', 'Temporal lobe', 'Maxillary sinus', 'Middle third of esophagus', 'Overlapping lesion of brain and central nervous system', 'Overlapping lesion of pancreas', 'Overlapping lesion of tonsil', 'Overlapping lesion of floor of mouth', 'Accessory sinus NOS', 'External lower lip', 'Vagina NOS', 'Parathyroid gland', 'Overlapping lesions of oropharynx', 'Overlapping lesion of esophagus', 'Overlapping lesion of colon', 'Base of tongue NOS', 'Overlapping lesion of vulva', 'Isthmus uteri', 'Long bones of upper limb scapula and associated joints', 'Overlapping lesion of digestive system', 'Overlapping lesion of bones joints and articular cartilage of limbs', 'Ill-defined sites within respiratory system', 'Lower-inner quadrant of breast', 'Fundus of stomach', 'Prostate gland', 'Spinal meninges', 'Supraglottis', 'Bladder neck', 'Connective subcutaneous and other soft tissues of abdomen', 'Mandible', 'Blood', 'Anal canal', 'Overlapping lesion of penis', 'Nervous system NOS', 'Lymph node NOS', 'Overlapping lesion of corpus uteri', 'Retroperitoneum', 'Pharynx NOS', 'Rib sternum clavicle and associated joints', 'Lower-outer quadrant of breast', 'Intrahepatic bile duct', 'Appendix', 'Lymph nodes of multiple regions', 'Occipital lobe', 'Cervix uteri', 'Fallopian tube', 'Endometrium', 'Ventricle NOS', 'Ampulla of Vater', 'Pineal gland', 'Pelvis NOS', 'Skin of scalp and neck', 'Brain stem', 'Islets of Langerhans', 'Endocervix', 'Upper limb NOS', 'Dome of bladder', 'Thoracic esophagus', 'Vertebral column', 'Short bones of lower limb and associated joints', 'Tongue NOS', 'Overlapping lesion of male genital organs', 'Exocervix', 'Splenic flexure of colon', 'Connective subcutaneous and other soft tissues of trunk NOS', 'Upper gum', 'Labium minus', 'Glottis', 'Overlapping lesion of lip', 'Mucosa of lower lip', 'Optic nerve', 'Kidney NOS', 'Pancreatic duct', 'Breast NOS', 'Pelvic bones sacrum coccyx and associated joints', 'Meckel diverticulum', 'Overlapping lesion of biliary tract', 'Overlapping lesion of tongue', 'Larynx NOS', 'Ileum', 'Pancreas NOS', 'Overlapping lesion of stomach', 'Abdominal esophagus', 'Intestinal tract NOS', 'Frontal sinus', 'Cardia NOS', 'Liver', 'Tonsillar pillar', 'Bone of limb NOS', 'Cauda equina', 'Other specified parts of male genital organs', 'Upper respiratory tract NOS', 'unknown primary site', 'Small intestine NOS', 'Upper third of esophagus', 'Connective subcutaneous and other soft tissues of thorax', 'Sigmoid colon', 'Lymph nodes of head face and neck', 'Pyriform sinus', 'Peripheral nerves and autonomic nervous system of trunk NOS', 'Lung NOS', 'Border of tongue', 'Tonsil NOS', 'Rectum NOS', 'Parietal lobe', 'Hypopharynx NOS', 'Heart', 'Mouth NOS', 'Hematopoietic system NOS', 'Superior wall of nasopharynx', 'Endocrine gland NOS', 'Craniopharyngeal duct', 'Overlapping lesion of heart mediastinum and pleura', 'Lymph nodes of axilla or arm', 'Head face or neck NOS', 'Medulla of adrenal gland', 'Lymph nodes of inguinal region or leg', 'Female genital tract NOS', 'Glans penis', 'skin of lower limb and hip', 'Body of stomach', 'Reticuloendothelial system NOS', 'Choroid', 'External upper lip', 'Prepuce', 'Posterior wall of nasopharynx', 'Urinary system NOS', 'Conjunctiva', 'Rectosigmoid junction', 'Intra-abdominal lymph nodes', 'Lingual tonsil', 'External lip NOS', 'Parotid gland', 'Bones of skull and face and associated joints', 'Dorsal surface of tongue NOS', 'Lip NOS', 'Connective subcutaneous and other soft tissues of head face and neck', 'Overlapping lesion of endocrine glands and related structures', 'Middle ear', 'Bladder NOS', 'Bone NOS', 'Trigone of bladder', 'Gallbladder', 'Descended testis', 'Orbit NOS', 'Descending colon', 'Spleen', 'Retromolar area', 'Ureter', 'skin of upper limb and shoulder', 'Pelvic lymph nodes', 'Floor of mouth NOS', 'Connective subcutaneous and other soft tissues NOS', 'Eye NOS', 'Myometrium', 'Lower third of esophagus', 'Body of pancreas', 'Mediastinum NOS', 'Sublingual gland', 'Anterior surface of epiglottis', 'Hard palate', 'Overlapping lesion of major salivary glands', 'Scrotum NOS', 'Ventral surface of tongue NOS', 'Submandibular gland', 'Oropharynx NOS', 'Lower limb NOS', 'Overlapping lesion of brain', 'Overlapping lesion of larynx', 'Cornea NOS', 'Corpus uteri', 'External ear', 'Commissure of lip', 'unknown', 'Cheek mucosa', 'Overlapping lesion of hypopharynx', 'Pituitary gland', 'Peripheral nerves and autonomic nervous system of head face and neck', 'Ascending colon', 'Epididymis', 'Esophagus NOS', 'Overlapping lesion of other and unspecified parts of mouth', 'Laryngeal cartilage', 'Skin of trunk', 'Transverse colon', 'Penis NOS', 'Ovary', 'Anterior wall of bladder', 'Carotid body', 'Colon NOS', 'Overlapping lesion of bones joints and articular cartilage', 'Jejunum', 'Spermatic cord', 'Long bones of lower limb and associated joints', 'Undescended testis', 'Head of pancreas', 'Vestibule of mouth', 'Middle lobe lung', 'Posterior wall of bladder', 'Overlapping lesion of eye and adnexa', 'Overlapping lesion of palate', 'Overlapping lesion of lip oral cavity and pharynx', 'Cerebral meninges', 'Sphenoid sinus', 'Gastrointestinal tract NOS', 'Uvula', 'Other specified parts of pancreas', 'Uterus NOS', 'Tail of pancreas', 'Acoustic nerve', 'Lacrimal gland', 'Cortex of adrenal gland', 'Palate NOS', 'Extrahepatic bile duct', 'Vallecula', 'Ciliary body', 'Hypopharyngeal aspect of aryepiglottic fold', 'Greater curvature of stomach NOS', 'Overlapping lesion of female genital organs', 'Retina', 'Other ill-defined sites', 'Posterior wall of hypopharynx', 'Urethra', 'Overlapping lesion of small intestine', 'Peripheral nerves and autonomic nervous system of pelvis', 'Overlapping lesion of retroperitoneum and peritoneum', 'Postcricoid region', 'Lower lobe lung', 'Skin of other and unspecified parts of face', 'Mucosa of lip NOS', 'Eyelid', 'Mucosa of upper lip', 'Paraurethral gland', 'Connective subcutaneous and other soft tissues of pelvis', 'Placenta', '']","['Progression or Recurrence is ""Yes - Progression or Recurrence""']",Diagnosis
Days to Recurrence,Days to Recurrence,DaystoRecurrence,Number of days between the date used for index and the date the patient's disease recurred. If not applicable please enter 'Not Applicable',False,True,,"['Progression or Recurrence is ""Yes - Progression or Recurrence""']",Diagnosis
Days to Progression Free,Days to Progression Free,DaystoProgressionFree,Number of days between the date used for index and the date the patient's disease was formally confirmed as progression-free. If not applicable please enter 'Not Applicable',False,True,,"['Progression or Recurrence is ""Yes - Progression or Recurrence""']",Diagnosis
Days to Progression,Days to Progression,DaystoProgression,Number of days between the date used for index and the date the patient's disease progressed. If not applicable please enter 'Not Applicable',False,True,,"['Progression or Recurrence is ""Yes - Progression or Recurrence""']",Diagnosis
Progression or Recurrence Type,Progression or Recurrence Type,ProgressionorRecurrenceType,The text term used to describe the type of progressive or recurrent disease or relapsed disease.,False,True,"['Distant', 'unknown', 'Local', 'Regional', 'Not Reported', 'Biochemical', '']","['Progression or Recurrence is ""Yes - Progression or Recurrence""']",Diagnosis
Treatment Dose Units,Treatment Dose Units,TreatmentDoseUnits,The text term used to describe the dose units of an agent the patient received.,False,,"['Gy', 'cGy', '']",,Therapy
HTAN Participant ID,HTAN Participant ID,HTANParticipantID,HTAN ID associated with a patient based on HTAN ID SOP (eg HTANx_yyy ),True,,,,Therapy
